{
  "schemaVersion": 1,
  "fixedStepMs": 100,
  "maxCatchUpSteps": 10,
  "simulationTimeoutMs": 120000,
  "maximumEnergy": 100,
  "minimumDamage": 1,
  "damageVarianceRatio": 0.08,
  "criticalChance": 0.08,
  "criticalMultiplier": 1.5,
  "dangerScaling": {
    "minimumDanger": 1,
    "maximumDanger": 7,
    "healthPerLevel": 0.08,
    "damagePerLevel": 0.04
  },
  "threatModifiers": {
    "castingWarningBonus": 6,
    "eliteBonus": 3,
    "bossBonus": 8
  },
  "encounterRules": {
    "combat": {
      "minimumUnits": 2,
      "maximumUnits": 4,
      "healthMultiplier": 1,
      "damageMultiplier": 1,
      "requiredTier": null,
      "allowedTiers": [
        "standard"
      ]
    },
    "elite": {
      "minimumUnits": 3,
      "maximumUnits": 5,
      "healthMultiplier": 1.25,
      "damageMultiplier": 1.15,
      "requiredTier": "elite",
      "allowedTiers": [
        "standard"
      ]
    },
    "boss": {
      "minimumUnits": 3,
      "maximumUnits": 3,
      "healthMultiplier": 1,
      "damageMultiplier": 1,
      "requiredTier": "boss",
      "allowedTiers": [
        "standard"
      ]
    }
  },
  "nonBossProgression": {
    "combat": {
      "farHealthRatio": 0.45,
      "farDamagePerSecondRatio": 0.42
    },
    "elite": {
      "farHealthRatio": 0.75,
      "farDamagePerSecondRatio": 0.7
    }
  },
  "difficultyScale": {
    "combat": 0.68,
    "elite": 0.68,
    "boss": 0.72
  }
}
